{
  "schemaVersion": 1,
  "slideVersionId": "01ARZ3NDEKTSV4RRFFQ69G5FB3",
  "slideId": "01ARZ3NDEKTSV4RRFFQ69G5FB2",
  "sourceSnapshotId": "01ARZ3NDEKTSV4RRFFQ69G5FB0",
  "status": "ready",
  "title": "年度经营复盘",
  "body": [
    "结论先行"
  ],
  "artifactId": "01ARZ3NDEKTSV4RRFFQ69G5FAZ",
  "createdAt": "2026-08-16T08:00:00Z"
}
